{
  "schema_version": "1.0",
  "generated_at": "2026-08-07T13:00:00-07:00",
  "local_date": "2026-08-07",
  "timezone": "America/Los_Angeles",
  "preferred_name": "Elisa",
  "source_status": [
    { "account_id": "sub-personal", "account_label": "Personal", "source": "gmail", "status": "complete" },
    { "account_id": "sub-personal", "account_label": "Personal", "source": "calendar", "status": "complete" }
  ],
  "top_of_mind": [],
  "fyi_groups": [],
  "calendar": [
    {
      "id": "cal-dentist",
      "title": "Dentist cleaning",
      "all_day": false,
      "start": "2026-08-07T09:00:00",
      "end": "2026-08-07T09:45:00",
      "timezone": "America/Los_Angeles",
      "duration_minutes": 45,
      "location": "1200 Market St",
      "context": "The confirmation email asks you to arrive 10 minutes early with your insurance card.",
      "citations": [
        { "source": "calendar", "account_id": "sub-personal", "account_label": "Personal", "source_ref": "calendar:evt-dentist" },
        { "source": "gmail", "account_id": "sub-personal", "account_label": "Personal", "source_ref": "gmail:msg-dentist-confirm" }
      ],
      "conflict_state": "none",
      "dedup_key": "event:dentist-cleaning:2026-08-07"
    }
  ],
  "conflicts": [],
  "omissions": []
}
